"Centro";"Nombre Centro";" ";"Asig. Inicial";"Inicial Ajustado";"Ejecutado";"Disponible";
"4087";"EFICIENCIA ENERGÉTICA EN ACCIONAMIENTOS";"";".00";"2,344,949.00";".00";"2,344,949.00"
"4187";"MONITOREO DE LA CALIDAD DE DIETA EN CONT";"";".00";"8,000,000.00";".00";"8,000,000.00"
"4282";"APORTE UAO - PLAN U FASE IV: LOS PROTOTI";"";".00";"7,730,000.00";".00";"7,730,000.00"
"4284";"DISEŃO DE ALGORITMO DE CONTROL EN CONVER";"";".00";"853,603.00";".00";"853,603.00"
"4285";"ESTUDIO DE FACTIBILIDAD DE PRODUCCIÓN DE";"";".00";"7,086,080.00";".00";"7,086,080.00"
"4286";"SISTEMAS ALTERNATIVOS PARA EL MANEJO DE";"";".00";"5,000,000.00";".00";"5,000,000.00"
"4287";"UN ENFOQUE DE ECONOMÍA CIRCULAR EN EL ME";"";".00";"20,000,000.00";".00";"20,000,000.00"
"4291";"DISEŃO DE UN MODELO PEDAGÓGICO DE REFERE";"";".00";"3,199,036.00";".00";"3,199,036.00"
"4292";"TECNOLOGÍA Y żNUDGE THEORYż APLICADA PAR";"";".00";"20,000,000.00";".00";"20,000,000.00"
"4293";"HACIA UNA EVALUACIÓN ESTANDARIZADA, SOST";"";".00";"11,800,000.00";".00";"11,800,000.00"
"4295";"INTELIGENCIA ARTIFICIAL GENERATIVA PARA";"";".00";"2,006,698.00";".00";"2,006,698.00"
"4296";"CREAI-MAKER: METODOLOGÍA PARA IMPULSAR E";"";".00";"8,968,712.00";".00";"8,968,712.00"
"4315";"SENIORSAFE: PROTOTIPO FUNCIONAL DE RASTR";"";".00";"3,087,503.00";"1,853,895.00";"1,233,608.00"
"4316";"MONITOREO PARTICIPATIVO DE LA CALIDAD DE";"";".00";"2,022,754.00";".00";"2,022,754.00"
"4317";"FORTALECIENDO LA COMPETITIVIDAD Y EL MER";"";".00";"6,849,020.00";".00";"6,849,020.00"
"4318";"DESARROLLO DE PLATAFORMA PARA FACILITAR";"";".00";"6,391,344.00";"1,420,475.00";"4,970,869.00"
"4320";"UTILIZACIÓN DE RESIDUOS DE LA COSECHA DE";"";".00";"10,800,000.00";".00";"10,800,000.00"
"4321";"ESTUDIO PSICOMÉTRICO DE LA PERSONALIDAD";"";".00";"8,000,000.00";".00";"8,000,000.00"
"4323";"DESARROLLO DE MATERIALES COMPUESTOS SOST";"";".00";"3,781,450.00";"3,780,000.00";"1,450.00"
"4324";"INCIDENCIA DE LAS CARACTERÍSTICAS MORFOS";"";".00";"8,000,000.00";".00";"8,000,000.00"
"4327";"CARACTERIZACIÓN DEL COMPORTAMIENTO DEL C";"";".00";"3,250,630.00";".00";"3,250,630.00"
"4331";"SISTEMA DE INFORMACIÓN FINANCIERA: HERRA";"";".00";"8,000,000.00";".00";"8,000,000.00"
"4334";"CARACTERIZACIÓN DE FACTORES DE SOSTENIBI";"";".00";"5,259,137.00";".00";"5,259,137.00"
"4335";"ESTUDIO DE LOS PROCESOS DE TRANSPORTE FL";"";".00";"8,000,000.00";".00";"8,000,000.00"
"4336";"SOSTENIBILIDAD Y COMPETITIVIDAD DE LAS P";"";".00";"10,000,000.00";".00";"10,000,000.00"
"4337";"BIOLOGICAL CONTROL OF INSECT VECTORS AND";"";".00";"5,000,000.00";".00";"5,000,000.00"
"4355";"IMPACTO DE LA PANDEMIA COVID 19 EN LA DI";"";".00";"8,000,000.00";".00";"8,000,000.00"
"4356";"PROP. INDICADORES CLAVE DE BIOECONÓMIA P";"";".00";"8,000,000.00";".00";"8,000,000.00"
"4357";"INTERVENCIONES PREV. PARA MEJORAR LA SAL";"";".00";"6,500,000.00";".00";"6,500,000.00"
"4358";"EVALUACIÓN EXPLORATORIA DEL POTENCIAL DE";"";".00";"8,000,000.00";".00";"8,000,000.00"
"4359";"ESTUDIO TEÓRICO-EXPERIMENTAL-ANALÍTICO D";"";".00";"8,000,000.00";".00";"8,000,000.00"
"4360";"CONTROL DE CONSENSO PARA INVERSORES DE T";"";".00";"8,000,000.00";".00";"8,000,000.00"
"4362";"DISEŃO DEL ESPACIO Y LA EXPER MUSEOGRÁFI";"";".00";"8,000,000.00";".00";"8,000,000.00"
"4363";"LIDERAZGO FEMENINO Y EXPERIENCIAS DE CUI";"";".00";"8,000,000.00";".00";"8,000,000.00"
"4364";"CONSTRUCCIÓN PARTICIPATIVA DE UN MODELO";"";".00";"8,000,000.00";".00";"8,000,000.00"
"4365";"DESARROLLO DE PROTOTIPOS DE VEHÍCULOS EL";"";".00";"79,750,100.00";".00";"79,750,100.00"
"4366";"APORTE UAO - PLAN U 2025. RES.8210 DE 20";"";".00";"8,870,000.00";".00";"8,870,000.00"
"4949";"PRODUCCIÓN DE BIOMATERIALES POLIMÉRICOS";"";".00";"3,727,028.00";".00";"3,727,028.00"
"4965";"MODELO DE CONTABILIDAD GERENCIAL PARA IN";"";".00";".00";"4,090,486.00";"-4,090,486.00"
"";"TOTAL EGRESOS PERIODO";"";".00";"348,278,044.00";"11,144,856.00";"337,133,188.00"
